{
  "name": "memory-kit",
  "version": "0.2.0",
  "data_version": 1,
  "api_version": 1,
  "node": "22.5.0",
  "upgrade_from": "0.1.0",
  "source": "https://github.com/8Krystof8/memory-kit.git",
  "files": {
    ".agents/skills/memory/SKILL.md": {
      "sha256": "f6f2776f21bc238f49efc9f889c54f045f5f01abde42dbb36d7abdf518d6c4b8",
      "group": "config"
    },
    ".claude/agents/memory-searcher.md": {
      "sha256": "05babbc4ac7d03a85728d1f5e629cdb5951b5876489cb2db122099b6ed53a4e6",
      "group": "config"
    },
    ".claude/settings.json": {
      "sha256": "400f48bce8758c3a18228a9598df340d758f4f0e4a899b1c873c85a9ac501ed3",
      "group": "config"
    },
    ".claude/skills/memory/SKILL.md": {
      "sha256": "f6f2776f21bc238f49efc9f889c54f045f5f01abde42dbb36d7abdf518d6c4b8",
      "group": "config"
    },
    ".gitattributes": {
      "sha256": "bc7b06d18938039cbc6ed0bc75ce982337fa1c5515eae7d157e86ade8ea1c648",
      "group": "config"
    },
    ".githooks/pre-commit": {
      "sha256": "c9b00e0ab449e2ea92dcd63df5aec0170be4e5a92faf32ef634f1c9d36de3b6e",
      "group": "config"
    },
    ".github/workflows/ci.yml": {
      "sha256": "70486bcb7f23287b9441e427f7e97d06d179bc6a7a03e82d0aa92d8c0e50ac1b",
      "group": "config"
    },
    "GEMINI.md": {
      "sha256": "336cc4fbf19beaada7ccf9986414fa91851a8d7a07dfb3ccbe800a69eed0ab49",
      "group": "config"
    },
    "docs/api.md": {
      "sha256": "86fd2ac37a43dc6667ac2040dca58d3ee7ba89a9ebb760e428de1c8f5f4075d0",
      "group": "docs"
    },
    "docs/architecture.md": {
      "sha256": "db8ad07995a41378a8a113cd0608600d0ce30d50a796f4324f862e629a526c37",
      "group": "docs"
    },
    "docs/install.md": {
      "sha256": "60d9692578d05f1a1e01fd970ed5f43be9a17c7b85b46ddd96b685409675d82c",
      "group": "docs"
    },
    "docs/integrations/chatgpt.md": {
      "sha256": "629ce42c591d6f2ee4fdcd4914e2125391c7a88a6b740b1da54b06681dbdc589",
      "group": "docs"
    },
    "docs/integrations/claude-app.md": {
      "sha256": "b4d37a15d0345591802dd503cc482b63ac7e797c0d0be53179da82a71f2d7545",
      "group": "docs"
    },
    "docs/integrations/claude-code.md": {
      "sha256": "9924d7d5e88b975670fb8bda07e19cf59c9617ea994bcd74e01d8512aaa54874",
      "group": "docs"
    },
    "docs/integrations/codex.md": {
      "sha256": "cdf8bd268158a5f88684c1d2aa8031b6ac089efd2e64e71534cb76cb3cc22d3d",
      "group": "docs"
    },
    "docs/integrations/cursor.md": {
      "sha256": "829db7d124f4693428a6da0b57b9f9239cd29b0d27e82e233703391990980268",
      "group": "docs"
    },
    "docs/integrations/gemini-cli.md": {
      "sha256": "5aaefef2a19448671b2d5f902cf82ad4db5f05412ec5fca8d937596d1fdb639f",
      "group": "docs"
    },
    "docs/integrations/mcp.md": {
      "sha256": "052cfd698986ee800039f2d6eb40d8ed1bd5c673480331cd2bbdf21e81c40726",
      "group": "docs"
    },
    "docs/maintenance.md": {
      "sha256": "c760eb01991de8b8d0066517d2a4c4c788b5394fd49b3b90d19c43c5f981a447",
      "group": "docs"
    },
    "docs/modes.md": {
      "sha256": "021c4cc794c80cbc013bd536c9c7df8702293b429f5a4cfbfd8e5a3495164931",
      "group": "docs"
    },
    "docs/phone.md": {
      "sha256": "e3f717c9e2003ec075f480ca2926cfc4201f122f225b5b8d1345e9ebec96df15",
      "group": "docs"
    },
    "docs/privacy.md": {
      "sha256": "7504c4627d2ebce87cd9c043af8f2f506800f28a01830d3019e0d73d25f643a6",
      "group": "docs"
    },
    "docs/projects.md": {
      "sha256": "56dc6edaef6c96bd9bab3ecba443caf741b9559bff9965b215e292453f8d0325",
      "group": "docs"
    },
    "docs/search.md": {
      "sha256": "4fb9bc735cde25d83ff60b2a64452b043f1362902c5314c78eddba83c90a41e9",
      "group": "docs"
    },
    "docs/upgrading.md": {
      "sha256": "9a2ae135ee2b17a8b8f40a5c9420c7d73436831925bc9f2998f8043893b3d32c",
      "group": "docs"
    },
    "install.ps1": {
      "sha256": "469ebed354ec0aedb225618135f503220b20e32201240511992eecc7e8636146",
      "group": "config"
    },
    "install.sh": {
      "sha256": "c12fd0c797be66a0c5e2e4004239f368d66ac597b6c76105c3cf6c489ed760aa",
      "group": "config"
    },
    "system/VERSION": {
      "sha256": "1f930dd1f133c1f97a94fe3acb8db34372cf4c01ffdb2b3ff4ca72f9494121e9",
      "group": "code"
    },
    "system/api.mjs": {
      "sha256": "db53bee7e9425699b54d52c6abe150cbdee9f9c8f166263d16e418d049eabbb0",
      "group": "code"
    },
    "system/init.mjs": {
      "sha256": "36740678fd7b5fa6385dae5c4fa631f9dbe08ef148348e32d0339633dc6a9df1",
      "group": "code"
    },
    "system/lang/LICENSE-snowball.txt": {
      "sha256": "986d3478432fb1d3493fbdf3b3d462a14d7de7047d79b91c64f5be433154b874",
      "group": "code"
    },
    "system/lang/cs/pack.json": {
      "sha256": "154bfc4e200c6646d7e65dc87dd854f4a079cd7f05b8d73f5d5b05bec0cf8b8f",
      "group": "code"
    },
    "system/lang/cs/stemmer.mjs": {
      "sha256": "a2f1336c8eb11db5fbeac1fa49e529d872fed6df90c0b01cd3c32c6805c094c9",
      "group": "code"
    },
    "system/lang/en/pack.json": {
      "sha256": "a7612886bb761031c39597534b05fc0e6ded1e26d43d99195da0039b8b4d638c",
      "group": "code"
    },
    "system/lang/en/stemmer.mjs": {
      "sha256": "99f70ea0e3ac64709996c593da006cfac5149b7194921685bd9cc882608c942b",
      "group": "code"
    },
    "system/lang/snowball-base.mjs": {
      "sha256": "78f18ab8e780b4e31c97fd0dc7dca620602b051ec053c8ffa8ff723c09a524b2",
      "group": "code"
    },
    "system/lib/activity.mjs": {
      "sha256": "f07e26965e0ba479be7898a9eb0de8ae5e419239c8abc40e4dae9ea29a2357a4",
      "group": "code"
    },
    "system/lib/capture.mjs": {
      "sha256": "8c5651284875b1a64a15ae128ebd11fd668b5fd73ac9d114e1ca940b05094909",
      "group": "code"
    },
    "system/lib/changelog.mjs": {
      "sha256": "a5e080cb146c7d908c6328ad9e48c15c1626a8dd69e390c57d51b86e4d60194c",
      "group": "code"
    },
    "system/lib/check.mjs": {
      "sha256": "c7cb7fe3f8e44ce5db859f883647ed5b664f7f275e0e95e35681dd5d4b1ef89a",
      "group": "code"
    },
    "system/lib/citations.mjs": {
      "sha256": "3b683493d286cf34f2a319df537050c702e5ece45e78caf4ee22b9e325bb933f",
      "group": "code"
    },
    "system/lib/clients.mjs": {
      "sha256": "8fa5fecb49706df41b7e8f62c91e812b82740e1db545bcfda2f4376e6a69b443",
      "group": "code"
    },
    "system/lib/commands/activity.mjs": {
      "sha256": "e408892410ea59f58a4cb15665a953c3541e14a21ba413b6b2afeb9c463de8b4",
      "group": "code"
    },
    "system/lib/commands/check.mjs": {
      "sha256": "13db0f59e9543d6afb45b57001de465b9d3bf41e16884f08b60d8b44d3ebd83b",
      "group": "code"
    },
    "system/lib/commands/connect.mjs": {
      "sha256": "68894a6b97fa820678f941a71f10b461fc5153b69e79bce063d8d2fb0ea0a762",
      "group": "code"
    },
    "system/lib/commands/doctor.mjs": {
      "sha256": "57ce734e89a78b8acd61b2b8ac0267bfa0a25051149984a67218785185871b2c",
      "group": "code"
    },
    "system/lib/commands/eval.mjs": {
      "sha256": "da2842253efe90d0c9bbc79c744aee46eb0f280a5c99743c2ba5ef63c51738a6",
      "group": "code"
    },
    "system/lib/commands/graph.mjs": {
      "sha256": "7471f07b0b71dcdbb46513a54e415e0533948dfaf34d243dfefa414a6f8ee1f9",
      "group": "code"
    },
    "system/lib/commands/hook.mjs": {
      "sha256": "561353609b466fecb182359ab6708989d5931d9b95d69f6ee23aa25cba8e5df4",
      "group": "code"
    },
    "system/lib/commands/mcp.mjs": {
      "sha256": "8ea66dce6eb5b128f9c036d3393d3c90b10be5e494fa628f14a3cba6c5dbb306",
      "group": "code"
    },
    "system/lib/commands/new.mjs": {
      "sha256": "1eb5c9f86acd61fb879ed57c3ae288c96dc77b659ca5469cba4c61e8fc9fffe5",
      "group": "code"
    },
    "system/lib/commands/project.mjs": {
      "sha256": "6b34163d2122115e2c024b9d374bd5579c760bf5d0e996017f0a66bc6f47f7c1",
      "group": "code"
    },
    "system/lib/commands/remember.mjs": {
      "sha256": "ee0fc25b30e67510c3c389d65a1df72b14de76e443d3c31587d92c044dd5f971",
      "group": "code"
    },
    "system/lib/commands/search.mjs": {
      "sha256": "888f77e9da0c8e35cfa3188b0cf96f8f052a320a3163f5196c915803a9aae1ad",
      "group": "code"
    },
    "system/lib/commands/sector.mjs": {
      "sha256": "3984975736d9558503acabbed99dff4e8b58c891bad989b31577dfd66c1558c2",
      "group": "code"
    },
    "system/lib/commands/setup.mjs": {
      "sha256": "8deb6db71af36c1486b26916aa53089e0781b523304d8ab822f81fbae391b484",
      "group": "code"
    },
    "system/lib/commands/start.mjs": {
      "sha256": "0f5ea20ddbbaeccb2ab692887c9db3f96ce57d976924095a8d0329972623568d",
      "group": "code"
    },
    "system/lib/commands/sync.mjs": {
      "sha256": "09d51f8de2e7765d659891bb600f413324d805b125cf466e3cf7ef9901478110",
      "group": "code"
    },
    "system/lib/commands/upgrade.mjs": {
      "sha256": "00391fd510806c8527943bfdadfec7255b8c68a46e18417b64a1602ffeb0de33",
      "group": "code"
    },
    "system/lib/config.mjs": {
      "sha256": "322c1c8ebd1d6894806d6f6034fac228d47de7cdd64c458ec874ab877f4e64b4",
      "group": "code"
    },
    "system/lib/doctor.mjs": {
      "sha256": "4f52f7ed41d64f1d705d1f79167f91eb3386d8632d1c0aea41ff879d8cae6feb",
      "group": "code"
    },
    "system/lib/eval.mjs": {
      "sha256": "171b4f58322e59878147ec4433d31af766feb109fb1c1e627d31493ec76ae8cc",
      "group": "code"
    },
    "system/lib/fingerprint.mjs": {
      "sha256": "b714af532f78f5436a0d63cc997907d98480a696ef8b99ac3495b6d9e1edb3a3",
      "group": "code"
    },
    "system/lib/frontmatter.mjs": {
      "sha256": "c70b7d7b6fd4bddd34538a1bf918150618a4c7534702a60d664ca2e85ca47b55",
      "group": "code"
    },
    "system/lib/fsafe.mjs": {
      "sha256": "d0b81834176aa4ccac6e11f92eef31d625acbdea7a7c3e8dc96f420678b1a97d",
      "group": "code"
    },
    "system/lib/generate.mjs": {
      "sha256": "e2c7cb9fae4be306495073450153843a814d76af1771e82c72c63e9408c85247",
      "group": "code"
    },
    "system/lib/graph.mjs": {